6471321,24212,紀和町花井,キワチョウケイ
6471322,24212,紀和町小船,キワチョウコブネ
6471325,24212,紀和町楊枝,キワチョウヨウジ
6471323,24212,紀和町楊枝川,キワチョウヨウジガワ
6471324,24212,紀和町和気,キワチョウワケ
6030000,26101,,
6038136,26101,出雲路神楽町,イズモジカグラチョウ
6038134,26101,出雲路立テ本町,イズモジタテモトチョウ
6038135,26101,出雲路俵町,イズモジタワラチョウ
6038133,26101,出雲路松ノ下町,イズモジマツノシタチョウ
6038481,26101,大北山鏡石町,オオキタヤマカガミイシチョウ
6038482,26101,大北山天神岡町,オオキタヤマテンジンオカチョウ
6038483,26101,大北山蓮ケ谷町,オオキタヤマハスガダニチョウ
6038488,26101,大北山長谷町,オオキタヤマハセチョウ
6038487,26101,大北山原谷乾町,オオキタヤマハラダニイヌイチョウ
6038457,26101,大北山不動山町,オオキタヤマフドウサンチョウ
6038458,26101,大北山鷲峯町,オオキタヤマワシミネチョウ
6038477,26101,大宮一ノ井町,オオミヤイチノイチョウ
6038401,26101,大宮上ノ岸町,オオミヤカミノキシチョウ
6038408,26101,大宮北椿原町,オオミヤキタツバキハラチョウ
6038831,26101,大宮北ノ岸町,オオミヤキタノキシチョウ
6038475,26101,大宮北箱ノ井町,オオミヤキタハコノイチョウ
6038407,26101,大宮北林町,オオミヤキタバヤシチョウ
6038472,26101,大宮北山ノ前町,オオミヤキタヤマノマエチョウ
6038461,26101,大宮玄琢北東町,オオミヤゲンタクキタヒガシチョウ
6038462,26101,大宮玄琢北町,オオミヤゲンタクキタマチ
6038463,26101,大宮玄琢南町,オオミヤゲンタクミナミマチ
6038478,26101,大宮釈迦谷,オオミヤシャカダニ
6038838,26101,大宮田尻町,オオミヤタジリチョウ
6038441,26101,大宮土居町,オオミヤドイチョウ
6038834,26101,大宮中総門口町,オオミヤナカソウモングチチョウ
6038837,26101,大宮中ノ社町,オオミヤナカノヤシロチョウ
6038404,26101,大宮中林町,オオミヤナカバヤシチョウ
6038405,26101,大宮西小野堀町,オオミヤニシオノボリチョウ
6038835,26101,大宮西総門口町,オオミヤニシソウモングチチョウ
6038444,26101,大宮西野山町,オオミヤニシノヤマチョウ
6038471,26101,大宮西山ノ前町,オオミヤニシヤマノマエチョウ
6038432,26101,大宮西脇台町,オオミヤニシワキダイチョウ
6038406,26101,大宮東小野堀町,オオミヤヒガシオノボリチョウ
6038833,26101,大宮東総門口町,オオミヤヒガシソウモングチチョウ
6038431,26101,大宮東脇台町,オオミヤヒガシワキダイチョウ
6038437,26101,大宮開町,オオミヤヒラキチョウ
6038832,26101,大宮南田尻町,オオミヤミナミタジリチョウ
6038402,26101,大宮南椿原町,オオミヤミナミツバキハラチョウ
6038476,26101,大宮南箱ノ井町,オオミヤミナミハコノイチョウ
6038403,26101,大宮南林町,オオミヤミナミバヤシチョウ
6038473,26101,大宮南山ノ前町,オオミヤミナミヤマノマエチョウ
6038479,26101,大宮薬師山西町,オオミヤヤクシヤマニシチョウ
6038474,26101,大宮薬師山東町,オオミヤヤクシヤマヒガシチョウ
6010142,26101,大森芦堂町,オオモリアシドウチョウ
6010141,26101,大森稲荷,オオモリイナリ
6010143,26101,大森中町,オオモリナカチョウ
6010144,26101,大森西町,オオモリニシチョウ
6010145,26101,大森東町,オオモリヒガシチョウ
6010134,26101,小野岩戸,オノイワト
6010133,26101,小野上ノ町,オノカミノチョウ
6010131,26101,小野下ノ町,オノシモノチョウ
6010132,26101,小野中ノ町,オノナカノチョウ
6010135,26101,小野宮ノ上町,オノミヤノカミチョウ
6038012,26101,上賀茂葵田町,カミガモアオイデンチョウ
6038034,26101,上賀茂葵之森町,カミガモアオイノモリチョウ
6038018,26101,上賀茂赤尾町,カミガモアカオチョウ
6038035,26101,上賀茂朝露ケ原町,カミガモアサツユガハラチョウ
6038044,26101,上賀茂畔勝町,カミガモアゼカチチョウ
6038061,26101,上賀茂荒草町,カミガモアラクサチョウ
6038066,26101,上賀茂池殿町,カミガモイケドノチョウ
6038043,26101,上賀茂池端町,カミガモイケバタチョウ
6038056,26101,上賀茂石計町,カミガモイシカズチョウ
6038017,26101,上賀茂壱町口町,カミガモイッチョウグチチョウ
6038063,26101,上賀茂今井河原町,カミガモイマイガワラチョウ
6038053,26101,上賀茂岩ケ垣内町,カミガモイワガカキウチチョウ
6038033,26101,上賀茂馬ノ目町,カミガモウマノメチョウ
6038087,26101,上賀茂梅ケ辻町,カミガモウメガツジチョウ
6038073,26101,上賀茂烏帽子ケ垣内町,カミガモエボシガカキウチチョウ
6038037,26101,上賀茂大柳町,カミガモオオヤナギチョウ
6038082,26101,上賀茂岡本口町,カミガモオカモトグチチョウ
6038081,26101,上賀茂岡本町,カミガモオカモトチョウ
6038038,26101,上賀茂音保瀬町,カミガモオトボセチョウ
6038013,26101,上賀茂上神原町,カミガモカミジンバラチョウ
6038071,26101,上賀茂北大路町,カミガモキタオオジチョウ
6038006,26101,上賀茂北ノ原町,カミガモキタノハラチョウ
6038007,26101,上賀茂毛穴井町,カミガモケアナイチョウ
6038041,26101,上賀茂ケシ山,カミガモケシヤマ
6038002,26101,上賀茂神山,カミガモコウヤマ
6038051,26101,上賀茂榊田町,カミガモサカキダチョウ
6038016,26101,上賀茂坂口町,カミガモサカグチチョウ
6038054,26101,上賀茂桜井町,カミガモサクライチョウ
6038014,26101,上賀茂下神原町,カミガモシモジンバラチョウ
6038001,26101,上賀茂十三石山,カミガモジュウサンゴクヤマ
6038064,26101,上賀茂菖蒲園町,カミガモショウブエンチョウ
6038085,26101,上賀茂蝉ケ垣内町,カミガモセミガカキウチチョウ
6038055,26101,上賀茂高縄手町,カミガモタカナワテチョウ
6038072,26101,上賀茂竹ケ鼻町,カミガモタケガハナチョウ
6038084,26101,上賀茂土門町,カミガモツチカドチョウ
6038027,26101,上賀茂津ノ国町,カミガモツノクニチョウ
6038045,26101,上賀茂豊田町,カミガモトヨタチョウ
6038075,26101,上賀茂中大路町,カミガモナカオオジチョウ
6038008,26101,上賀茂中嶋河原町,カミガモナカジマガワラチョウ
6038032,26101,上賀茂中ノ河原町,カミガモナカノカワラチョウ
6038024,26101,上賀茂中ノ坂町,カミガモナカノサカチョウ
6038026,26101,上賀茂中山町,カミガモナカヤマチョウ
6038011,26101,上賀茂二軒家町,カミガモニケンヤチョウ
6038028,26101,上賀茂西上之段町,カミガモニシウエノダンチョウ
6038036,26101,上賀茂西河原町,カミガモニシガワラチョウ
6038021,26101,上賀茂西後藤町,カミガモニシゴトウチョウ
6038042,26101,上賀茂狭間町,カミガモハザマチョウ
6038003,26101,上賀茂柊谷町,カミガモヒイラギダニチョウ
6038023,26101,上賀茂東上之段町,カミガモヒガシウエノダンチョウ
6038022,26101,上賀茂東後藤町,カミガモヒガシゴトウチョウ
6038015,26101,上賀茂備後田町,カミガモビンゴデンチョウ
6038077,26101,上賀茂藤ノ木町,カミガモフジノキチョウ
6038025,26101,上賀茂舟着町,カミガモフナツキチョウ
6038005,26101,上賀茂前田町,カミガモマエダチョウ
6038052,26101,上賀茂松本町,カミガモマツモトチョウ
6038065,26101,上賀茂御薗口町,カミガモミソノグチチョウ
6038046,26101,上賀茂深泥池町,カミガモミドロイケチョウ
6038074,26101,上賀茂南大路町,カミガモミナミオオジチョウ
6038086,26101,上賀茂向梅町,カミガモムカイウメチョウ
6038083,26101,上賀茂向縄手町,カミガモムカイナワテチョウ
6038031,26101,上賀茂女夫岩町,カミガモメオトイワチョウ
6038047,26101,上賀茂本山,カミガモモトヤマ
6038062,26101,上賀茂薮田町,カミガモヤブタチョウ
6038076,26101,上賀茂山本町,カミガモヤマモトチョウ
6038004,26101,上賀茂六段田町,カミガモロクダンダチョウ
6038147,26101,上御霊上江町,カミゴリョウカミエチョウ
6038155,26101,上清蔵口町,カミセイゾウグチチョウ
6038325,26101,北野上白梅町,キタノカミハクバイチョウ
6038324,26101,北野紅梅町,キタノコウバイチョウ
6038326,26101,北野下白梅町,キタノシモハクバイチョウ
6038327,26101,北野西白梅町,キタノニシハクバイチョウ
6038323,26101,北野東紅梅町,キタノヒガシコウバイチョウ
6038486,26101,衣笠赤阪町,キヌガサアカサカチョウ
6038315,26101,衣笠荒見町,キヌガサアラミチョウ
6038351,26101,衣笠大祓町,キヌガサオオハライチョウ
6038372,26101,衣笠街道町,キヌガサガイドウチョウ
6038451,26101,衣笠鏡石町,キヌガサカガミイシチョウ
6038316,26101,衣笠北荒見町,キヌガサキタアラミチョウ
6038373,26101,衣笠北高橋町,キヌガサキタタカハシチョウ
6038376,26101,衣笠北天神森町,キヌガサキタテンジンモリチョウ
6038485,26101,衣笠衣笠山町,キヌガサキヌガサヤマチョウ
6038378,26101,衣笠御所ノ内町,キヌガサゴショノウチチョウ
6038363,26101,衣笠総門町,キヌガサソウモンチョウ
6038374,26101,衣笠高橋町,キヌガサタカハシチョウ
6038375,26101,衣笠天神森町,キヌガサテンジンモリチョウ
6038377,26101,衣笠西御所ノ内町,キヌガサニシゴショノウチチョウ
6038456,26101,衣笠西尊上院町,キヌガサニシソンジョウインチョウ
6038366,26101,衣笠西馬場町,キヌガサニシババチョウ
6038454,26101,衣笠西開キ町,キヌガサニシヒラキチョウ
6038362,26101,衣笠馬場町,キヌガサババチョウ
6038371,26101,衣笠東御所ノ内町,キヌガサヒガシゴショノウチチョウ
6038455,26101,衣笠東尊上院町,キヌガサヒガシソンジョウインチョウ
6038453,26101,衣笠東開キ町,キヌガサヒガシヒラキチョウ
6038484,26101,衣笠氷室町,キヌガサヒムロチョウ
6038452,26101,衣笠開キ町,キヌガサヒラキチョウ
6038361,26101,金閣寺町,キンカクジチョウ
6038861,26101,雲ケ畑出谷町,クモガハタデタニチョウ
6038862,26101,雲ケ畑中津川町,クモガハタナカツガワチョウ
6038863,26101,雲ケ畑中畑町,クモガハタナカハタチョウ
6038137,26101,鞍馬口町,クラマグチチョウ
6038341,26101,小松原北町,コマツバラキタマチ
6038342,26101,小松原南町,コマツバラミナミマチ
6038125,26101,小山板倉町,コヤマイタクラチョウ
6038126,26101,小山上板倉町,コヤマカミイタクラチョウ
6038131,26101,小山上内河原町,コヤマカミウチカワラチョウ
6038171,26101,小山上初音町,コヤマカミハツネチョウ
6038121,26101,小山上花ノ木町,コヤマカミハナノキチョウ
6038143,26101,小山上総町,コヤマカミフサチョウ
6038161,26101,小山北大野町,コヤマキタオオノチョウ
6038142,26101,小山北上総町,コヤマキタカミフサチョウ
6038103,26101,小山北玄以町,コヤマキタゲンイチョウ
6038124,26101,小山下板倉町,コヤマシモイタクラチョウ
6038132,26101,小山下内河原町,コヤマシモウチカワラチョウ
6038173,26101,小山下初音町,コヤマシモハツネチョウ
6038123,26101,小山下花ノ木町,コヤマシモハナノキチョウ
6038151,26101,小山下総町,コヤマシモフサチョウ
6038156,26101,小山中溝町,コヤマナカミゾチョウ
6038167,26101,小山西大野町,コヤマニシオオノチョウ
6038141,26101,小山西上総町,コヤマニシカミフサチョウ
6038105,26101,小山西玄以町,コヤマニシゲンイチョウ
6038148,26101,小山西花池町,コヤマニシハナイケチョウ
6038113,26101,小山西元町,コヤマニシモトマチ
6038172,26101,小山初音町,コヤマハツネチョウ
6038122,26101,小山花ノ木町,コヤマハナノキチョウ
6038162,26101,小山東大野町,コヤマヒガシオオノチョウ
6038104,26101,小山東玄以町,コヤマヒガシゲンイチョウ
6038144,26101,小山東花池町,コヤマヒガシハナイケチョウ
6038111,26101,小山東元町,コヤマヒガシモトマチ
6038145,26101,小山堀池町,コヤマホリイケチョウ
6038163,26101,小山南大野町,コヤマミナミオオノチョウ
6038149,26101,小山南上総町,コヤマミナミカミフサチョウ
6038112,26101,小山元町,コヤマモトマチ
6038152,26101,小山町,コヤマチョウ
6038207,26101,紫竹牛若町,シチクウシワカチョウ
6038179,26101,紫竹上梅ノ木町,シチクカミウメノキチョウ
6038117,26101,紫竹上高才町,シチクカミコウサイチョウ
6038423,26101,紫竹上芝本町,シチクカミシバモトチョウ
6038421,26101,紫竹上園生町,シチクカミソノウチョウ
6038411,26101,紫竹上竹殿町,シチクカミタケドノチョウ
6038102,26101,紫竹上長目町,シチクカミナガメチョウ
6038108,26101,紫竹上ノ岸町,シチクカミノキシチョウ
6038101,26101,紫竹上堀川町,シチクカミホリカワチョウ
6038116,26101,紫竹上本町,シチクカミホンマチ
6038427,26101,紫竹上緑町,シチクカミミドリチョウ
6038433,26101,紫竹北栗栖町,シチクキタクリスチョウ
6038416,26101,紫竹北大門町,シチクキタダイモンチョウ
6038435,26101,紫竹栗栖町,シチククリスチョウ
6038178,26101,紫竹下梅ノ木町,シチクシモウメノキチョウ
6038114,26101,紫竹下高才町,シチクシモコウサイチョウ
6038424,26101,紫竹下芝本町,シチクシモシバモトチョウ
6038422,26101,紫竹下園生町,シチクシモソノウチョウ
6038412,26101,紫竹下竹殿町,シチクシモタケドノチョウ
6038106,26101,紫竹下長目町,シチクシモナガメチョウ
6038107,26101,紫竹下ノ岸町,シチクシモノキシチョウ
6038115,26101,紫竹下本町,シチクシモホンマチ
6038425,26101,紫竹下緑町,シチクシモミドリチョウ
6038206,26101,紫竹西南町,シチクセイナンチョウ
6038426,26101,紫竹西北町,シチクセイホクチョウ
6038414,26101,紫竹大門町,シチクダイモンチョウ
6038204,26101,紫竹高縄町,シチクタカナワチョウ
6038417,26101,紫竹竹殿町,シチクタケドノチョウ
6038436,26101,紫竹西栗栖町,シチクニシクリスチョウ
6038415,26101,紫竹西大門町,シチクニシダイモンチョウ
6038205,26101,紫竹西高縄町,シチクニシタカナワチョウ
6038443,26101,紫竹西野山町,シチクニシノヤマチョウ
6038442,26101,紫竹西野山東町,シチクニシノヤマヒガシマチ
6038208,26101,紫竹西桃ノ本町,シチクニシモモノモトチョウ
6038434,26101,紫竹東栗栖町,シチクヒガシクリスチョウ
6038413,26101,紫竹東大門町,シチクヒガシダイモンチョウ
6038203,26101,紫竹東高縄町,シチクヒガシタカナワチョウ
6038202,26101,紫竹東桃ノ本町,シチクヒガシモモノモトチョウ
6038201,26101,紫竹桃ノ本町,シチクモモノモトチョウ
6038139,26101,上善寺門前町,ジョウゼンジモンゼンチョウ
6038146,26101,新御霊口町,シンゴリョウグチチョウ
6010111,26101,杉阪北尾,スギサカキタオ
6010113,26101,杉阪道風町,スギサカトウフウチョウ
6010112,26101,杉阪都町,スギサカミヤコチョウ
6038336,26101,大将軍一条町,タイショウグンイチジョウチョウ
6038332,26101,大将軍川端町,タイショウグンカワバタチョウ
6038335,26101,大将軍坂田町,タイショウグンサカタチョウ
6038334,26101,大将軍西鷹司町,タイショウグンニシタカツカサチョウ
6038331,26101,大将軍西町,タイショウグンニシマチ
6038333,26101,大将軍東鷹司町,タイショウグンヒガシタカツカサチョウ
6038337,26101,大将軍南一条町,タイショウグンミナミイチジョウチョウ
6038493,26101,鷹峯大谷町,タカガミネオオタニチョウ
6038446,26101,鷹峯上ノ町,タカガミネカミノチョウ
6038468,26101,鷹峯北鷹峯町,タカガミネキタタカガミネチョウ
6038447,26101,鷹峯木ノ畑町,タカガミネキノハタチョウ
6038448,26101,鷹峯旧土居町,タカガミネキュウドイチョウ
6038464,26101,鷹峯黒門町,タカガミネクロモンチョウ
6038466,26101,鷹峯光悦町,タカガミネコウエツチョウ
6038469,26101,鷹峯千束町,タカガミネセンゾクチョウ
6038465,26101,鷹峯土天井町,タカガミネツチテンジョウチョウ
6038492,26101,鷹峯堂ノ庭町,タカガミネドウノニワチョウ
6038445,26101,鷹峯藤林町,タカガミネフジバヤシチョウ
6038491,26101,鷹峯仏谷,タカガミネホトケダニ
6038494,26101,鷹峯堀越町,タカガミネホリコシチョウ
6038467,26101,鷹峯南鷹峯町,タカガミネミナミタカガミネチョウ
6038154,26101,長乗西町,チョウジョウニシマチ
6038153,26101,長乗東町,チョウジョウヒガシマチ
6038138,26101,天寧寺門前町,テンネイジモンゼンチョウ
6038346,26101,等持院北町,トウジインキタマチ
6038347,26101,等持院中町,トウジインナカマチ
6038354,26101,等持院西町,トウジインニシマチ
6038343,26101,等持院東町,トウジインヒガシマチ
6038344,26101,等持院南町,トウジインミナミマチ
6010125,26101,中川川登,ナカガワカワノボリ
6010122,26101,中川北山町,ナカガワキタヤマチョウ
6010124,26101,中川中山,ナカガワナカヤマ
6010123,26101,中川西山,ナカガワニシヤマ
6010121,26101,中川東山,ナカガワヒガシヤマ
6038804,26101,西賀茂井ノ口町,ニシガモイノクチチョウ
6038842,26101,西賀茂今原町,ニシガモイマハラチョウ
6038828,26101,西賀茂大栗町,ニシガモオオクリチョウ
6038813,26101,西賀茂大道口町,ニシガモオオドグチチョウ
6038844,26101,西賀茂大深町,ニシガモオオブケチョウ
6038807,26101,西賀茂蛙ケ谷,ニシガモカエルガタニ
6038821,26101,西賀茂柿ノ木町,ニシガモカキノキチョウ
6038852,26101,西賀茂笠松,ニシガモカサマツ
6038805,26101,西賀茂蟹ケ坂町,ニシガモカニガサカチョウ
6038822,26101,西賀茂鹿ノ下町,ニシガモカノシタチョウ
6038802,26101,西賀茂上庄田町,ニシガモカミショウダチョウ
6038817,26101,西賀茂川上町,ニシガモカワカミチョウ
6038841,26101,西賀茂北今原町,ニシガモキタイマハラチョウ
6038816,26101,西賀茂北川上町,ニシガモキタカワカミチョウ
6038847,26101,西賀茂北鎮守菴町,ニシガモキタチンジュアンチョウ
6038811,26101,西賀茂北山ノ森町,ニシガモキタヤマノモリチョウ
6038801,26101,西賀茂下庄田町,ニシガモシモショウダチョウ
6038853,26101,西賀茂城山,ニシガモシロヤマ
6038836,26101,西賀茂神光院町,ニシガモジンコウインチョウ
6038845,26101,西賀茂角社町,ニシガモスミヤシロチョウ
6038846,26101,西賀茂鎮守菴町,ニシガモチンジュアンチョウ
6038815,26101,西賀茂中川上町,ニシガモナカカワカミチョウ
6038854,26101,西賀茂西氷室町,ニシガモニシヒムロチョウ
6038823,26101,西賀茂榿ノ木町,ニシガモハリノキチョウ
6038803,26101,西賀茂樋ノ口町,ニシガモヒノクチチョウ
6038855,26101,西賀茂氷室町,ニシガモヒムロチョウ
6038848,26101,西賀茂船山,ニシガモフネヤマ
6038826,26101,西賀茂坊ノ後町,ニシガモボウノウシロチョウ
6038856,26101,西賀茂蓬来谷,ニシガモホウライダニ
6038825,26101,西賀茂丸川町,ニシガモマルカワチョウ
6038806,26101,西賀茂円峰,ニシガモマルミネ
6038827,26101,西賀茂水垣町,ニシガモミズガキチョウ
6038843,26101,西賀茂南今原町,ニシガモミナミイマハラチョウ
6038824,26101,西賀茂南大栗町,ニシガモミナミオオクリチョウ
6038814,26101,西賀茂南川上町,ニシガモミナミカワカミチョウ
6038812,26101,西賀茂山ノ森町,ニシガモヤマノモリチョウ
6038851,26101,西賀茂鑓磨岩,ニシガモヤリトギイワ
6038353,26101,平野上八丁柳町,ヒラノカミハッチョウヤナギチョウ
6038355,26101,平野上柳町,ヒラノカミヤナギチョウ
6038364,26101,平野桜木町,ヒラノサクラギチョウ
6038321,26101,平野鳥居前町,ヒラノトリイマエチョウ
6038345,26101,平野八丁柳町,ヒラノハッチョウヤナギチョウ
6038356,26101,平野東柳町,ヒラノヒガシヤナギチョウ
6038352,26101,平野宮北町,ヒラノミヤキタチョウ
6038365,26101,平野宮敷町,ヒラノミヤジキチョウ
6038357,26101,平野宮西町,ヒラノミヤニシチョウ
6038322,26101,平野宮本町,ヒラノミヤモトチョウ
6010102,26101,真弓善福,マユミゼンプク
6010101,26101,真弓八幡町,マユミハチマンチョウ
6038243,26101,紫野今宮町,ムラサキノイマミヤチョウ
6038242,26101,紫野上野町,ムラサキノウエノチョウ
6038214,26101,紫野雲林院町,ムラサキノウンリンインチョウ
6038311,26101,紫野上柏野町,ムラサキノカミカシワノチョウ
6038166,26101,紫野上御所田町,ムラサキノカミゴショデンチョウ
6038211,26101,紫野上石龍町,ムラサキノカミセキリュウチョウ
6038221,26101,紫野上築山町,ムラサキノカミツキヤマチョウ
6038176,26101,紫野上鳥田町,ムラサキノカミトリダチョウ
6038236,26101,紫野上御輿町,ムラサキノカミミコシチョウ
6038217,26101,紫野上門前町,ムラサキノカミモンゼンチョウ
6038177,26101,紫野上柳町,ムラサキノカミヤナギチョウ
6038237,26101,紫野上若草町,ムラサキノカミワカクサチョウ
6038301,26101,紫野北花ノ坊町,ムラサキノキタハナノボウチョウ
6038227,26101,紫野北舟岡町,ムラサキノキタフナオカチョウ
6038304,26101,紫野郷ノ上町,ムラサキノゴウノウエチョウ
6038313,26101,紫野下柏野町,ムラサキノシモカシワノチョウ
6038213,26101,紫野下石龍町,ムラサキノシモセキリュウチョウ
6038222,26101,紫野下築山町,ムラサキノシモツキヤマチョウ
6038175,26101,紫野下鳥田町,ムラサキノシモトリダチョウ
6038235,26101,紫野下御輿町,ムラサキノシモミコシチョウ
6038215,26101,紫野下門前町,ムラサキノシモモンゼンチョウ
6038174,26101,紫野下柳町,ムラサキノシモヤナギチョウ
6038234,26101,紫野下若草町,ムラサキノシモワカクサチョウ
6038303,26101,紫野十二坊町,ムラサキノジュウニボウチョウ
6038212,26101,紫野石龍町,ムラサキノセキリュウチョウ
6038247,26101,紫野泉堂町,ムラサキノセンドウチョウ
6038231,26101,紫野大徳寺町,ムラサキノダイトクジチョウ
6038312,26101,紫野中柏野町,ムラサキノナカカシワノチョウ
6038165,26101,紫野西御所田町,ムラサキノニシゴショデンチョウ
6038246,26101,紫野西泉堂町,ムラサキノニシセンドウチョウ
6038314,26101,紫野西土居町,ムラサキノニシドイチョウ
6038233,26101,紫野西野町,ムラサキノニシノチョウ
6038224,26101,紫野西藤ノ森町,ムラサキノニシフジノモリチョウ
6038226,26101,紫野西舟岡町,ムラサキノニシフナオカチョウ
6038245,26101,紫野西蓮台野町,ムラサキノニシレンダイノチョウ
6038302,26101,紫野花ノ坊町,ムラサキノハナノボウチョウ
6038164,26101,紫野東御所田町,ムラサキノヒガシゴショデンチョウ
6038241,26101,紫野東泉堂町,ムラサキノヒガシセンドウチョウ
6038232,26101,紫野東野町,ムラサキノヒガシノチョウ
6038223,26101,紫野東藤ノ森町,ムラサキノヒガシフジノモリチョウ
6038228,26101,紫野東舟岡町,ムラサキノヒガシフナオカチョウ
6038244,26101,紫野東蓮台野町,ムラサキノヒガシレンダイノチョウ
6038305,26101,紫野南花ノ坊町,ムラサキノミナミハナノボウチョウ
6038225,26101,紫野南舟岡町,ムラサキノミナミフナオカチョウ
6038158,26101,紫野宮西町,ムラサキノミヤニシチョウ
6038157,26101,紫野宮東町,ムラサキノミヤヒガシチョウ
6038216,26101,紫野門前町,ムラサキノモンゼンチョウ
6020000,26102,,
6020827,26102,相生町,アイオイチョウ
6028278,26102,愛染寺町,アイゼンジチョウ
6020054,26102,飛鳥井町,アスカイチョウ
6020923,26102,油橋詰町,アブラハシヅメチョウ
6028165,26102,尼ケ崎横町,アマガサキヨコチョウ
6028424,26102,阿弥陀寺町,アミダジチョウ
6020803,26102,阿弥陀寺前町,アミダジマエチョウ
6028074,26102,有春町,アリハルチョウ
6028472,26102,有馬町,アリマチョウ
6020064,26102,安楽小路町,アンラクコウジチョウ
