6010401,26108,京北片波町,ケイホクカタナミチョウ
6010402,26108,京北上黒田町,ケイホクカミクロダチョウ
6010532,26108,京北上中町,ケイホクカミナカチョウ
6010531,26108,京北上弓削町,ケイホクカミユゲチョウ
6010271,26108,京北熊田町,ケイホククマタチョウ
6010252,26108,京北五本松町,ケイホクゴホンマツチョウ
6010536,26108,京北塩田町,ケイホクシオタチョウ
6010543,26108,京北室谷町,ケイホクシツタンチョウ
6010266,26108,京北下宇津町,ケイホクシモウツチョウ
6010272,26108,京北下熊田町,ケイホクシモクマタチョウ
6010405,26108,京北下黒田町,ケイホクシモクロダチョウ
6010324,26108,京北下町,ケイホクシモチョウ
6010533,26108,京北下中町,ケイホクシモナカチョウ
6010534,26108,京北下弓削町,ケイホクシモユゲチョウ
6010251,26108,京北周山町,ケイホクシュウザンチョウ
6010404,26108,京北芹生町,ケイホクセリョウチョウ
6010542,26108,京北田貫町,ケイホクタヌキチョウ
6010265,26108,京北中地町,ケイホクチュウジチョウ
6010322,26108,京北辻町,ケイホクツジチョウ
6010321,26108,京北塔町,ケイホクトウチョウ
6010264,26108,京北栃本町,ケイホクトチモトチョウ
6010323,26108,京北鳥居町,ケイホクトリイチョウ
6010315,26108,京北中江町,ケイホクナカエチョウ
6010276,26108,京北西町,ケイホクニシチョウ
6010403,26108,京北灰屋町,ケイホクハイヤチョウ
6010312,26108,京北初川町,ケイホクハツカワチョウ
6010316,26108,京北比賀江町,ケイホクヒガエチョウ
6010262,26108,京北細野町,ケイホクホソノチョウ
6010406,26108,京北宮町,ケイホクミヤチョウ
6010278,26108,京北矢代中町,ケイホクヤシロナカチョウ
6010263,26108,京北弓槻町,ケイホクユヅキチョウ
6150061,26108,西院乾町,サイインイヌイチョウ
6150035,26108,西院追分町,サイインオイワケチョウ
6150036,26108,西院太田町,サイインオオタチョウ
6150058,26108,西院笠目町,サイインカサメチョウ
6150015,26108,西院春日町,サイインカスガチョウ
6150006,26108,西院金槌町,サイインカナヅチチョウ
6150001,26108,西院上今田町,サイインカミイマダチョウ
6150007,26108,西院上花田町,サイインカミハナダチョウ
6150063,26108,西院北井御料町,サイインキタイゴリョウチョウ
6150026,26108,西院北矢掛町,サイインキタヤカケチョウ
6150064,26108,西院久田町,サイインクデンチョウ
6150053,26108,西院久保田町,サイインクボタチョウ
6150012,26108,西院高山寺町,サイインコウザンジチョウ
6150067,26108,西院小米町,サイインコゴメチョウ
6150033,26108,西院寿町,サイインコトブキチョウ
6150021,26108,西院三蔵町,サイインサンゾウチョウ
6150066,26108,西院四条畑町,サイインシジョウバタチョウ
6150052,26108,西院清水町,サイインシミズチョウ
6150004,26108,西院下花田町,サイインシモハナダチョウ
6150005,26108,西院春栄町,サイインシュンエイチョウ
6150031,26108,西院高田町,サイインタカダチョウ
6150014,26108,西院巽町,サイインタツミチョウ
6150054,26108,西院月双町,サイインツキソウチョウ
6150043,26108,西院中水町,サイインナカミズチョウ
6150003,26108,西院西今田町,サイインニシイマダチョウ
6150056,26108,西院西貝川町,サイインニシカイガワチョウ
6150034,26108,西院西寿町,サイインニシコトブキチョウ
6150027,26108,西院西三蔵町,サイインニシサンゾウチョウ
6150016,26108,西院西淳和院町,サイインニシジュンナインチョウ
6150032,26108,西院西高田町,サイインニシタカダチョウ
6150055,26108,西院西田町,サイインニシダチョウ
6150044,26108,西院西中水町,サイインニシナカミズチョウ
6150023,26108,西院西平町,サイインニシヒラマチ
6150046,26108,西院西溝崎町,サイインニシミゾサキチョウ
6150025,26108,西院西矢掛町,サイインニシヤカケチョウ
6150002,26108,西院東今田町,サイインヒガシイマダチョウ
6150057,26108,西院東貝川町,サイインヒガシカイガワチョウ
6150011,26108,西院東淳和院町,サイインヒガシジュンナインチョウ
6150042,26108,西院東中水町,サイインヒガシナカミズチョウ
6150062,26108,西院坤町,サイインヒツジサルチョウ
6150065,26108,西院日照町,サイインヒデリチョウ
6150022,26108,西院平町,サイインヒラマチ
6150013,26108,西院松井町,サイインマツイチョウ
6150045,26108,西院溝崎町,サイインミゾサキチョウ
6150037,26108,西院南井御料町,サイインミナミイゴリョウチョウ
6150048,26108,西院南寿町,サイインミナミコトブキチョウ
6150041,26108,西院南高田町,サイインミナミタカダチョウ
6150024,26108,西院矢掛町,サイインヤカケチョウ
6150051,26108,西院安塚町,サイインヤスヅカチョウ
6150047,26108,西院六反田町,サイインロクタンダチョウ
6168343,26108,嵯峨朝日町,サガアサヒチョウ
6168458,26108,嵯峨愛宕町,サガアタゴチョウ
6168335,26108,嵯峨石ケ坪町,サガイシガツボチョウ
6168365,26108,嵯峨伊勢ノ上町,サガイセノカミチョウ
6168354,26108,嵯峨一本木町,サガイッポンギチョウ
6168344,26108,嵯峨梅ノ木町,サガウメノキチョウ
6168411,26108,嵯峨大沢町,サガオオサワチョウ
6168395,26108,嵯峨小倉山町,サガオグラヤマチョウ
6168345,26108,嵯峨折戸町,サガオリトチョウ
6168341,26108,嵯峨甲塚町,サガカブトヅカチョウ
6168386,26108,嵯峨亀ノ尾町,サガカメノオチョウ
6168387,26108,嵯峨亀山町,サガカメヤマチョウ
6168342,26108,嵯峨苅分町,サガカリワケチョウ
6168367,26108,嵯峨北堀町,サガキタボリチョウ
6168452,26108,嵯峨清滝町,サガキヨタキチョウ
6168362,26108,嵯峨五島町,サガゴトウチョウ
6168355,26108,嵯峨新宮町,サガシングウチョウ
6168351,26108,嵯峨釣殿町,サガツリドノチョウ
6168336,26108,嵯峨蜻蛉尻町,サガトンボジリチョウ
6168361,26108,嵯峨中通町,サガナカドオリチョウ
6168383,26108,嵯峨中之島町,サガナカノシマチョウ
6168347,26108,嵯峨中又町,サガナカマタチョウ
6168364,26108,嵯峨中山町,サガナカヤマチョウ
6168393,26108,嵯峨野々宮町,サガノノミヤチョウ
6168301,26108,嵯峨広沢町,サガヒロサワチョウ
6168334,26108,嵯峨罧原町,サガフシハラチョウ
6168337,26108,嵯峨明星町,サガミョウジョウチョウ
6168363,26108,嵯峨柳田町,サガヤナギダチョウ
6168352,26108,嵯峨大沢落久保町,サガオオサワオチクボチョウ
6168353,26108,嵯峨大沢柳井手町,サガオオサワヤナギイデチョウ
6168397,26108,嵯峨小倉山小倉町,サガオグラヤマオグラチョウ
6168394,26108,嵯峨小倉山田渕山町,サガオグラヤマタブチヤマチョウ
6168392,26108,嵯峨小倉山堂ノ前町,サガオグラヤマドウノマエチョウ
6168391,26108,嵯峨小倉山緋明神町,サガオグラヤマヒノミョウジンチョウ
6168396,26108,嵯峨小倉山山本町,サガオグラヤマヤマモトチョウ
6168445,26108,嵯峨観空寺岡崎町,サガカンクウジオカザキチョウ
6168444,26108,嵯峨観空寺久保殿町,サガカンクウジクボデンチョウ
6168446,26108,嵯峨観空寺谷町,サガカンクウジダニチョウ
6168443,26108,嵯峨観空寺明水町,サガカンクウジミョウズイチョウ
6168451,26108,嵯峨清滝一華表町,サガキヨタキイッカヒョウチョウ
6168453,26108,嵯峨清滝大谷町,サガキヨタキオオタニチョウ
6168457,26108,嵯峨清滝空也滝町,サガキヨタキクウヤダキチョウ
6168455,26108,嵯峨清滝田鶴原町,サガキヨタキタヅハラチョウ
6168456,26108,嵯峨清滝月ノ輪町,サガキヨタキツキノワチョウ
6168454,26108,嵯峨清滝深谷町,サガキヨタキフカタニチョウ
6168491,26108,嵯峨越畑北ノ町,サガコシハタキタノチョウ
6168482,26108,嵯峨越畑正権条,サガコシハタショウゴンジョウ
6168494,26108,嵯峨越畑尻谷,サガコシハタシリタニ
6168484,26108,嵯峨越畑筋違,サガコシハタスジチガイ
6168492,26108,嵯峨越畑天慶,サガコシハタテンケイ
6168487,26108,嵯峨越畑中ノ町,サガコシハタナカノチョウ
6168483,26108,嵯峨越畑鍋浦,サガコシハタナベウラ
6168485,26108,嵯峨越畑兵庫前町,サガコシハタヒョウゴマエチョウ
6168486,26108,嵯峨越畑南ノ町,サガコシハタミナミノチョウ
6168481,26108,嵯峨越畑桃原,サガコシハタモモハラ
6168493,26108,嵯峨越畑桃原垣内,サガコシハタモモハラガイチ
6168471,26108,嵯峨樒原稲荷元町,サガシキミガハライナリモトチョウ
6168474,26108,嵯峨樒原清水町,サガシキミガハラシミズチョウ
6168472,26108,嵯峨樒原高見町,サガシキミガハラタカミチョウ
6168475,26108,嵯峨樒原宮ノ上町,サガシキミガハラミヤノウエチョウ
6168473,26108,嵯峨樒原若宮下町,サガシキミガハラワカミヤシタチョウ
6168422,26108,嵯峨釈迦堂大門町,サガシャカドウダイモンチョウ
6168447,26108,嵯峨釈迦堂藤ノ木町,サガシャカドウフジノキチョウ
6168423,26108,嵯峨釈迦堂門前裏柳町,サガシャカドウモンゼンウラヤナギチョウ
6168421,26108,嵯峨釈迦堂門前瀬戸川町,サガシャカドウモンゼンセトガワチョウ
6168424,26108,嵯峨釈迦堂門前南中院町,サガシャカドウモンゼンミナミチュウインチョウ
6168416,26108,嵯峨大覚寺門前井頭町,サガダイカクジモンゼンイトウチョウ
6168413,26108,嵯峨大覚寺門前堂ノ前町,サガダイカクジモンゼンドウノマエチョウ
6168412,26108,嵯峨大覚寺門前登り町,サガダイカクジモンゼンノボリチョウ
6168414,26108,嵯峨大覚寺門前八軒町,サガダイカクジモンゼンハッケンチョウ
6168415,26108,嵯峨大覚寺門前宮ノ下町,サガダイカクジモンゼンミヤノシタチョウ
6168417,26108,嵯峨大覚寺門前六道町,サガダイカクジモンゼンロクドウチョウ
6168346,26108,嵯峨天龍寺油掛町,サガテンリュウジアブラカケチョウ
6168366,26108,嵯峨天龍寺今堀町,サガテンリュウジイマホリチョウ
6168374,26108,嵯峨天龍寺北造路町,サガテンリュウジキタツクリミチチョウ
6168373,26108,嵯峨天龍寺車道町,サガテンリュウジクルマミチチョウ
6168357,26108,嵯峨天龍寺椎野町,サガテンリュウジシイノチョウ
6168385,26108,嵯峨天龍寺芒ノ馬場町,サガテンリュウジススキノババチョウ
6168382,26108,嵯峨天龍寺角倉町,サガテンリュウジスミノクラチョウ
6168376,26108,嵯峨天龍寺瀬戸川町,サガテンリュウジセトガワチョウ
6168375,26108,嵯峨天龍寺立石町,サガテンリュウジタテイシチョウ
6168384,26108,嵯峨天龍寺造路町,サガテンリュウジツクリミチチョウ
6168356,26108,嵯峨天龍寺中島町,サガテンリュウジナカジマチョウ
6168372,26108,嵯峨天龍寺広道町,サガテンリュウジヒロミチチョウ
6168381,26108,嵯峨天龍寺龍門町,サガテンリュウジリュウモンチョウ
6168371,26108,嵯峨天龍寺若宮町,サガテンリュウジワカミヤチョウ
6168436,26108,嵯峨鳥居本化野町,サガトリイモトアダシノチョウ
6168431,26108,嵯峨鳥居本一華表町,サガトリイモトイッカヒョウチョウ
6168432,26108,嵯峨鳥居本北代町,サガトリイモトキタダイチョウ
6168435,26108,嵯峨鳥居本小坂町,サガトリイモトコザカチョウ
6168437,26108,嵯峨鳥居本仙翁町,サガトリイモトセンノウチョウ
6168433,26108,嵯峨鳥居本中筋町,サガトリイモトナカスジチョウ
6168439,26108,嵯峨鳥居本深谷町,サガトリイモトフカタニチョウ
6168434,26108,嵯峨鳥居本仏餉田町,サガトリイモトブツショウデンチョウ
6168438,26108,嵯峨鳥居本六反町,サガトリイモトロクタンチョウ
6168426,26108,嵯峨二尊院門前往生院町,サガニソンインモンゼンオウジョウインチョウ
6168428,26108,嵯峨二尊院門前北中院町,サガニソンインモンゼンキタチュウインチョウ
6168427,26108,嵯峨二尊院門前善光寺山町,サガニソンインモンゼンゼンコウジヤマチョウ
6168425,26108,嵯峨二尊院門前長神町,サガニソンインモンゼンチョウジンチョウ
6168314,26108,嵯峨野秋街道町,サガノアキカイドウチョウ
6168316,26108,嵯峨野有栖川町,サガノアリスガワチョウ
6168331,26108,嵯峨野内田町,サガノウチダチョウ
6168317,26108,嵯峨野神ノ木町,サガノカミノキチョウ
6168332,26108,嵯峨野北野町,サガノキタノチョウ
6168311,26108,嵯峨野嵯峨ノ段町,サガノサガノダンマチ
6168322,26108,嵯峨野芝野町,サガノシバノチョウ
6168312,26108,嵯峨野清水町,サガノシミズチョウ
6168325,26108,嵯峨野高田町,サガノタカダチョウ
6168321,26108,嵯峨野千代ノ道町,サガノチヨノミチチョウ
6168323,26108,嵯峨野投渕町,サガノナゲブチチョウ
6168333,26108,嵯峨野西ノ藤町,サガノニシノフジチョウ
6168326,26108,嵯峨野東田町,サガノヒガシダチョウ
6168313,26108,嵯峨野開町,サガノヒラキチョウ
6168324,26108,嵯峨野南浦町,サガノミナミウラチョウ
6168315,26108,嵯峨野宮ノ元町,サガノミヤノモトチョウ
6168327,26108,嵯峨野六反田町,サガノロクタンダチョウ
6168307,26108,嵯峨広沢池下町,サガヒロサワイケシタチョウ
6168302,26108,嵯峨広沢北下馬野町,サガヒロサワキタゲバノチョウ
6168305,26108,嵯峨広沢御所ノ内町,サガヒロサワゴショノウチチョウ
6168306,26108,嵯峨広沢西裏町,サガヒロサワニシウラチョウ
6168303,26108,嵯峨広沢南下馬野町,サガヒロサワミナミゲバノチョウ
6168304,26108,嵯峨広沢南野町,サガヒロサワミナミノチョウ
6168467,26108,嵯峨水尾大岩,サガミズオオオイワ
6168462,26108,嵯峨水尾岡ノ窪町,サガミズオオカノクボチョウ
6168468,26108,嵯峨水尾北垣内町,サガミズオキタガイチチョウ
6168466,26108,嵯峨水尾清和,サガミズオセイワ
6168463,26108,嵯峨水尾竹ノ尻町,サガミズオタケノシリチョウ
6168461,26108,嵯峨水尾鳩ケ巣,サガミズオハトガス
6168465,26108,嵯峨水尾宮ノ脇町,サガミズオミヤノワキチョウ
6168464,26108,嵯峨水尾武蔵嶋町,サガミズオムサシジマチョウ
6168014,26108,谷口梅津間町,タニグチウメヅマチョウ
6168022,26108,谷口円成寺町,タニグチエンジョウジチョウ
6168012,26108,谷口垣ノ内町,タニグチカキノウチチョウ
6168013,26108,谷口唐田ノ内町,タニグチカラタノウチチョウ
6168015,26108,谷口園町,タニグチソノマチ
6168216,26108,常盤一ノ井町,トキワイチノイチョウ
6168225,26108,常盤馬塚町,トキワウマヅカチョウ
6168211,26108,常盤御池町,トキワオイケチョウ
6168213,26108,常盤音戸町,トキワオントチョウ
6168231,26108,常盤柏ノ木町,トキワカシノキチョウ
6168219,26108,常盤神田町,トキワカンダチョウ
6168229,26108,常盤北裏町,トキワキタウラチョウ
6168227,26108,常盤草木町,トキワクサキチョウ
6168224,26108,常盤窪町,トキワクボマチ
6168228,26108,常盤下田町,トキワシモダチョウ
6168226,26108,常盤段ノ上町,トキワダンノウエチョウ
6168218,26108,常盤出口町,トキワデグチチョウ
6168222,26108,常盤仲之町,トキワナカノチョウ
6168223,26108,常盤西町,トキワニシマチ
6168217,26108,常盤東ノ町,トキワヒガシノチョウ
6168214,26108,常盤古御所町,トキワフルゴショチョウ
6168221,26108,常盤村ノ内町,トキワムラノウチチョウ
6168215,26108,常盤森町,トキワモリマチ
6168212,26108,常盤山下町,トキワヤマシタチョウ
6168253,26108,鳴滝泉谷町,ナルタキイズミタニチョウ
6168241,26108,鳴滝泉殿町,ナルタキイズミデンチョウ
6168251,26108,鳴滝宇多野谷,ナルタキウダノタニ
6168255,26108,鳴滝音戸山町,ナルタキオンドヤマチョウ
6168246,26108,鳴滝川西町,ナルタキカワニシチョウ
6168238,26108,鳴滝桐ケ淵町,ナルタキキリガフチチョウ
6168234,26108,鳴滝嵯峨園町,ナルタキサガソノチョウ
6168257,26108,鳴滝白砂,ナルタキシラスナ
6168254,26108,鳴滝宅間町,ナルタキタクマチョウ
6168233,26108,鳴滝中道町,ナルタキナカミチチョウ
6168235,26108,鳴滝西嵯峨園町,ナルタキニシサガソノチョウ
6168247,26108,鳴滝蓮池町,ナルタキハスイケチョウ
6168236,26108,鳴滝春木町,ナルタキハルキチョウ
6168258,26108,鳴滝般若寺町,ナルタキハンニャジチョウ
6168244,26108,鳴滝藤ノ木町,ナルタキフジノキチョウ
6168242,26108,鳴滝本町,ナルタキホンマチ
6168256,26108,鳴滝松本町,ナルタキマツモトチョウ
6168237,26108,鳴滝瑞穂町,ナルタキミズホチョウ
6168243,26108,鳴滝安井殿町,ナルタキヤスイデンチョウ
6168232,26108,鳴滝蓮花寺町,ナルタキレンゲジチョウ
6150806,26108,西京極畔勝町,ニシキョウゴクアゼカツチョウ
6150885,26108,西京極午塚町,ニシキョウゴクウマヅカチョウ
6150882,26108,西京極葛野町,ニシキョウゴクカドノチョウ
6150843,26108,西京極河原町,ニシキョウゴクカワラチョウ
6150836,26108,西京極河原町裏町,ニシキョウゴクカワラチョウウラマチ
6150821,26108,西京極北裏町,ニシキョウゴクキタウラチョウ
6150881,26108,西京極北大入町,ニシキョウゴクキタオオイリチョウ
6150878,26108,西京極北衣手町,ニシキョウゴクキタコロモデチョウ
6150802,26108,西京極北庄境町,ニシキョウゴクキタショウザカイチョウ
6150818,26108,西京極三反田町,ニシキョウゴクサンタンダチョウ
6150826,26108,西京極芝ノ下町,ニシキョウゴクシバノシタチョウ
6150814,26108,西京極下沢町,ニシキョウゴクシモザワチョウ
6150874,26108,西京極新田町,ニシキョウゴクシンデンチョウ
6150864,26108,西京極新明町,ニシキョウゴクシンメイチョウ
6150845,26108,西京極末広町,ニシキョウゴクスエヒロチョウ
6150812,26108,西京極大門町,ニシキョウゴクダイモンチョウ
6150804,26108,西京極町ノ坪町,ニシキョウゴクチョウノツボチョウ
6150813,26108,西京極佃田町,ニシキョウゴクツクダチョウ
6150835,26108,西京極堤下町,ニシキョウゴクツツミシタチョウ
6150854,26108,西京極堤外町,ニシキョウゴクツツミソトチョウ
6150863,26108,西京極堤町,ニシキョウゴクツツミチョウ
6150846,26108,西京極徳大寺団子田町,ニシキョウゴクトクダイジダンゴデンチョウ
6150875,26108,西京極徳大寺西団子田町,ニシキョウゴクトクダイジニシダンゴデンチョウ
6150834,26108,西京極殿田町,ニシキョウゴクトノダチョウ
6150815,26108,西京極中沢町,ニシキョウゴクナカザワチョウ
6150822,26108,西京極中町,ニシキョウゴクナカマチ
6150831,26108,西京極長町,ニシキョウゴクナガマチ
6150811,26108,西京極中溝町,ニシキョウゴクナカミゾチョウ
6150827,26108,西京極南方町,ニシキョウゴクナンポウチョウ
6150851,26108,西京極西池田町,ニシキョウゴクニシイケダチョウ
6150862,26108,西京極西大丸町,ニシキョウゴクニシオオマルチョウ
6150852,26108,西京極西川町,ニシキョウゴクニシカワチョウ
6150877,26108,西京極西衣手町,ニシキョウゴクニシコロモデチョウ
6150855,26108,西京極西団子田町,ニシキョウゴクニシダンゴデンチョウ
6150837,26108,西京極西向河原町,ニシキョウゴクニシムコウガワラチョウ
6150861,26108,西京極野田町,ニシキョウゴクノダチョウ
6150832,26108,西京極走上リ町,ニシキョウゴクハシアガリチョウ
6150833,26108,西京極橋詰町,ニシキョウゴクハシヅメチョウ
6150824,26108,西京極畑田町,ニシキョウゴクハタダチョウ
6150873,26108,西京極浜ノ本町,ニシキョウゴクハマノモトチョウ
6150841,26108,西京極火打畑町,ニシキョウゴクヒウチバタチョウ
6150805,26108,西京極東池田町,ニシキョウゴクヒガシイケダチョウ
6150807,26108,西京極東大丸町,ニシキョウゴクヒガシオオマルチョウ
6150844,26108,西京極東側町,ニシキョウゴクヒガシガワチョウ
6150871,26108,西京極東衣手町,ニシキョウゴクヒガシコロモデチョウ
6150816,26108,西京極東町,ニシキョウゴクヒガシチョウ
6150825,26108,西京極東向河原町,ニシキョウゴクヒガシムコウガワラチョウ
6150856,26108,西京極古浜町,ニシキョウゴクフルハマチョウ
6150823,26108,西京極前田町,ニシキョウゴクマエダチョウ
6150801,26108,西京極豆田町,ニシキョウゴクマメダチョウ
6150883,26108,西京極南大入町,ニシキョウゴクミナミオオイリチョウ
6150872,26108,西京極南衣手町,ニシキョウゴクミナミコロモデチョウ
6150803,26108,西京極南庄境町,ニシキョウゴクミナミショウザカイチョウ
6150817,26108,西京極宮ノ東町,ニシキョウゴクミヤノヒガシチョウ
6150838,26108,西京極薮ノ下町,ニシキョウゴクヤブノシタチョウ
6150842,26108,西京極薮開町,ニシキョウゴクヤブビラキチョウ
6150857,26108,西京極郡猪馬場町,ニシキョウゴクゴオリイノババチョウ
6150858,26108,西京極郡沢町,ニシキョウゴクゴオリサワチョウ
6150853,26108,西京極郡醍醐田町,ニシキョウゴクゴオリダイゴデンチョウ
6150876,26108,西京極郡附洲町,ニシキョウゴクゴオリフズチョウ
6150884,26108,西京極郡町,ニシキョウゴクゴオリチョウ
6168024,26108,花園一条田町,ハナゾノイチジョウデンチョウ
6168037,26108,花園猪ノ毛町,ハナゾノイノケチョウ
6168042,26108,花園伊町,ハナゾノイマチ
6168045,26108,花園内畑町,ハナゾノウチハタチョウ
6168027,26108,花園円成寺町,ハナゾノエンジョウジチョウ
6168044,26108,花園扇野町,ハナゾノオウギノチョウ
6168023,26108,花園大薮町,ハナゾノオオヤブチョウ
6168026,26108,花園岡ノ本町,ハナゾノオカノモトチョウ
6168061,26108,花園春日町,ハナゾノカスガチョウ
6168034,26108,花園木辻北町,ハナゾノキツジキタマチ
6168057,26108,花園木辻南町,ハナゾノキツジミナミチョウ
6168055,26108,花園車道町,ハナゾノクルマミチチョウ
6168056,26108,花園坤南町,ハナゾノコンナンチョウ
6168033,26108,花園艮北町,ハナゾノコンボクチョウ
6168051,26108,花園巽南町,ハナゾノソンナンチョウ
6168031,26108,花園鷹司町,ハナゾノタカツカサチョウ
6168046,26108,花園段ノ岡町,ハナゾノダンノオカチョウ
6168025,26108,花園土堂町,ハナゾノツチドウチョウ
6168043,26108,花園寺ノ内町,ハナゾノテラノウチチョウ
6168036,26108,花園寺ノ中町,ハナゾノテラノナカチョウ
6168041,26108,花園寺ノ前町,ハナゾノテラノマエチョウ
6168021,26108,花園天授ケ岡町,ハナゾノテンジュガオカチョウ
6168054,26108,花園中御門町,ハナゾノナカミカドチョウ
6168032,26108,花園馬代町,ハナゾノバダイチョウ
6168047,26108,花園宮ノ上町,ハナゾノミヤノカミチョウ
6168035,26108,花園妙心寺町,ハナゾノミョウシンジチョウ
6168053,26108,花園八ツ口町,ハナゾノヤツクチチョウ
6168052,26108,花園薮ノ下町,ハナゾノヤブノシタチョウ
6168197,26108,山越乾町,ヤマゴエイヌイチョウ
6168193,26108,山越巽町,ヤマゴエタツミチョウ
6168195,26108,山越中町,ヤマゴエナカチョウ
6168196,26108,山越西町,ヤマゴエニシチョウ
6168194,26108,山越東町,ヤマゴエヒガシチョウ
6150073,26108,山ノ内荒木町,ヤマノウチアラキチョウ
6150072,26108,山ノ内池尻町,ヤマノウチイケジリチョウ
6150097,26108,山ノ内大町,ヤマノウチオオマチ
6150094,26108,山ノ内北ノ口町,ヤマノウチキタノクチチョウ
6150096,26108,山ノ内五反田町,ヤマノウチゴタンダチョウ
6150082,26108,山ノ内赤山町,ヤマノウチセキサンチョウ
6150083,26108,山ノ内瀬戸畑町,ヤマノウチセトハタチョウ
6150074,26108,山ノ内苗町,ヤマノウチナエマチ
6150085,26108,山ノ内中畑町,ヤマノウチナカハタチョウ
6150071,26108,山ノ内西裏町,ヤマノウチニシウラチョウ
6150095,26108,山ノ内西八反田町,ヤマノウチニシハッタンダチョウ
